{
  "schemaVersion": 1,
  "id": "pinballctl.lane-completion-light-chase",
  "name": "Lane-completion light chase",
  "description": "Unavailable: Requires a fixture-aware progress/timed-effect generator and tested reset/stop semantics; select an existing Lighting scene manually instead.",
  "category": "Media / lighting",
  "icon": "music",
  "author": "Pinball CTL",
  "version": "1.0.0",
  "minimumAppVersion": "0.10.0",
  "minimumRuntimeVersion": 2,
  "availability": "unavailable",
  "prerequisites": [
    "Requires a fixture-aware progress/timed-effect generator and tested reset/stop semantics; select an existing Lighting scene manually instead."
  ],
  "steps": [],
  "rules": [],
  "warnings": [],
  "tags": []
}
