{
  "schemaVersion": 1,
  "id": "pinballctl.timed-ball-save",
  "name": "Timed ball save",
  "description": "Unavailable: Requires cancellable scheduled events and a reliable timed ball save lifecycle. Time-since-event conditions only run when an event arrives; they cannot schedule a timeout.",
  "category": "Ball handling",
  "icon": "circle",
  "author": "Pinball CTL",
  "version": "1.0.0",
  "minimumAppVersion": "0.10.0",
  "minimumRuntimeVersion": 2,
  "availability": "unavailable",
  "prerequisites": [
    "Requires cancellable scheduled events and a reliable timed ball save lifecycle. Time-since-event conditions only run when an event arrives; they cannot schedule a timeout."
  ],
  "steps": [],
  "rules": [],
  "warnings": [],
  "tags": []
}
