{
  "schemaVersion": 1,
  "id": "pinballctl.attract-lighting",
  "name": "Attract lighting",
  "description": "Configure attract lighting using ordinary editable rules.",
  "category": "Media / lighting",
  "icon": "music",
  "author": "Pinball CTL",
  "version": "1.0.0",
  "minimumAppVersion": "0.10.0",
  "minimumRuntimeVersion": 2,
  "availability": "available",
  "prerequisites": [],
  "steps": [
    {
      "title": "Choose event and scene",
      "fields": [
        {
          "id": "lighting",
          "label": "Existing lighting scene",
          "type": "lighting"
        }
      ]
    }
  ],
  "rules": [
    {
      "name": "Attract lighting",
      "triggers": [
        {
          "type": "system",
          "event": "IDLE_ENTERED"
        }
      ],
      "actions": [
        {
          "type": "apply_lighting_scene",
          "params": {},
          "target": {
            "$answer": "lighting"
          }
        }
      ],
      "conditions": []
    }
  ],
  "warnings": [
    "Only starts an existing scene. Configure its duration and behaviour in Lighting; no multiball or scoring service is created."
  ],
  "tags": []
}
