{
  "schemaVersion": 1,
  "id": "pinballctl.spinning-disc",
  "name": "Spinning disc",
  "description": "Unavailable: Requires a dedicated spinning disc driver with reviewed stop/fault handling and safety limits; current Rules output actions do not implement that device lifecycle.",
  "category": "Playfield mechanisms",
  "icon": "bolt",
  "author": "Pinball CTL",
  "version": "1.0.0",
  "minimumAppVersion": "0.10.0",
  "minimumRuntimeVersion": 2,
  "availability": "unavailable",
  "prerequisites": [
    "Requires a dedicated spinning disc driver with reviewed stop/fault handling and safety limits; current Rules output actions do not implement that device lifecycle."
  ],
  "steps": [],
  "rules": [],
  "warnings": [],
  "tags": []
}
